[
  {
    "schema_version": "0.1.0",
    "id": "urn:lex-mx:federal:nom:nom-020-stps-2011:transitory:primero",
    "standard_id": "urn:lex-mx:federal:nom:nom-020-stps-2011",
    "ordinal": "PRIMERO",
    "text": "PRIMERO.- La presente Norma Oficial Mexicana entrará en vigor a los seis meses siguientes a su\npublicación en el Diario Oficial de la Federación.",
    "start_char": 182812,
    "end_char": 182957
  },
  {
    "schema_version": "0.1.0",
    "id": "urn:lex-mx:federal:nom:nom-020-stps-2011:transitory:segundo",
    "standard_id": "urn:lex-mx:federal:nom:nom-020-stps-2011",
    "ordinal": "SEGUNDO",
    "text": "SEGUNDO.- Durante el período señalado en el artículo anterior, los patrones cumplirán con lo establecido\nen la NOM-020-STPS-2002, Recipientes sujetos a presión y calderas - Funcionamiento - Condiciones de\nseguridad, o bien realizarán las adaptaciones para observar las disposiciones de la presente Norma Oficial\nMexicana NOM-020-STPS-2011, Recipientes sujetos a presión, recipientes criogénicos y generadores de\nvapor o calderas - Funcionamiento - Condiciones de seguridad y, en este último caso, las autoridades del\ntrabajo proporcionarán, a petición de los patrones interesados, asesoría y orientación para instrumentar su\ncumplimiento, sin que se hagan acreedores a sanciones por el incumplimiento de la Norma en vigor.",
    "start_char": 182962,
    "end_char": 183684
  },
  {
    "schema_version": "0.1.0",
    "id": "urn:lex-mx:federal:nom:nom-020-stps-2011:transitory:tercero",
    "standard_id": "urn:lex-mx:federal:nom:nom-020-stps-2011",
    "ordinal": "TERCERO",
    "text": "TERCERO.- En el transcurso del período a que se refiere el artículo anterior, los patrones podrán obtener\nlas autorizaciones de funcionamiento o de ampliación de vigencia de la autorización de funcionamiento de los\nequipos que lo requieran, de conformidad con los procedimientos establecidos en los numerales 8.1 a 8.6\nde la NOM-020-STPS-2002, Recipientes sujetos a presión y calderas - Funcionamiento – Condiciones\nde seguridad, o bien podrán presentar ante la Secretaría el aviso a que se refiere el numeral 5.13 de la\npresente Norma Oficial Mexicana NOM-020-STPS-2011, Recipientes sujetos a presión, recipientes\ncriogénicos y generadores de vapor o calderas - Funcionamiento - Condiciones de seguridad, en el caso de\nque los equipos correspondan a los clasificados dentro de la Categoría III de la presente Norma.",
    "start_char": 183689,
    "end_char": 184505
  },
  {
    "schema_version": "0.1.0",
    "id": "urn:lex-mx:federal:nom:nom-020-stps-2011:transitory:cuarto",
    "standard_id": "urn:lex-mx:federal:nom:nom-020-stps-2011",
    "ordinal": "CUARTO",
    "text": "CUARTO.- Los patrones que posean equipos que cuenten con autorización de funcionamiento a la fecha\nde inicio de vigencia de la presente Norma, emitida al amparo del numeral 8.2 de la NOM-020-STPS-2002,\nRecipientes sujetos a presión y calderas - Funcionamiento - Condiciones de seguridad, podrán presentar ante\nla Secretaría el aviso a que se refieren los numerales 5.13 y 16.1, párrafo final, de la presente Norma Oficial\nMexicana NOM-020-STPS-2011, Recipientes sujetos a presión, recipientes criogénicos y generadores de\nvapor o calderas - Funcionamiento - Condiciones de seguridad, dentro de los sesenta días previos a la\nconclusión de la vigencia que ampare la referida autorización, en caso de que el equipo corresponda a los\nclasificados dentro de la Categoría III.\n\f",
    "start_char": 184510,
    "end_char": 185404
  },
  {
    "schema_version": "0.1.0",
    "id": "urn:lex-mx:federal:nom:nom-020-stps-2011:transitory:quinto",
    "standard_id": "urn:lex-mx:federal:nom:nom-020-stps-2011",
    "ordinal": "QUINTO",
    "text": "QUINTO.- A partir de la fecha en que entre en vigor la presente Norma Oficial Mexicana, quedará sin\nefectos la NOM-020-STPS-2002, Recipientes sujetos a presión y calderas - Funcionamiento - Condiciones de\nseguridad, publicada en el Diario Oficial de la Federación de 28 de agosto de 2002, con excepción de lo\ndispuesto en el párrafo siguiente.\n   Tratándose de las autorizaciones para el funcionamiento de los recipientes sujetos a presión y\ngeneradores de vapor o calderas, previstas por los artículos 29, fracción II, y 31 del Reglamento Federal\nde Seguridad, Higiene y Medio Ambiente de Trabajo, se estará a lo dispuesto por los numerales 8.2, 8.4 y 8.5\nde la NOM-020-STPS-2002, Recipientes sujetos a presión y calderas - Funcionamiento – Condiciones\nde seguridad, en tanto la Secretaría emita los lineamientos de operación para el otorgamiento de dichas\nautorizaciones, atento a lo dispuesto por el artículo 19, fracción XVIII, del Reglamento Interior de la Secretaría\ndel Trabajo y Previsión Social, en caso de que el equipo corresponda a los clasificados dentro de la\nCategoría III.",
    "start_char": 185410,
    "end_char": 186498,
    "asserted_dates": [
      "2002-08-28"
    ]
  }
]
